title,date,text,url
QuantumScape (QS) Q3 2023: prototype solid-state test cells exceed performance targets,2023-10-26 00:00:00,"Following the close of Q3 2023, solid-state battery developer QuantumScape has updated the public to its progress the last three months, which includes some encouraging results. In addition to catching a peep at mockups of its production-intent QSE-5 cell design, QuantumScape’s prototype has done better than expected with one automotive OEM in particular. Are solid-state EVs closer than we imagined? QuantumScape says maybe, but it still has some work to do.

If you don’t know the name QuantumScape ($QS) by now, you should probably start educating yourself (don’t worry, we have plenty of previous coverage for you to study). The advanced battery technology company has been working for over a decade to develop scalable, energy-dense solid-state battery cells that can one day achieve cost parity with traditional lithium-ion cells popular in current EV models.

While there are plenty of competitors out there chasing a future powered by safer and more efficient solid-state cells, QuantumScape hit its own major breakthrough in 2020 by utilizing a proprietary ceramic separator. This technology led to single-layer prototype cell testing, followed by 10-layer cells, then 16-layer prototypes.

By Q2 of 2022, QuantumScape’s solid-state had expanded to 24 layers, setting the stage for vigorous internal testing and the beginning of a three-step journey (A, B, and C prototype cells) before entering automotive qualification and (hopefully) commercialized production.

In December of 2022, QuantumScape began delivering the first 24-layer A0 prototype cells to automotive partners to test themselves, and by Q1 of 2023, testing had been completed by at least one unnamed EV OEM.

At that same time, QuantumScape shared that its first commercial solid-state product will be an ~5 Ah cell called QSE-5 (seen above), which also began shipping to OEM partners as of Q2 2023. Now, QuantumScape has posted its Q3 2023 report, and A0 prototype testing has delivered results that were better than expected.

A mockup of QuantumScape’s QSE-5 solid-state cell with FlexFrame / Credit: QuantumScape

QuantumScape rolls in Q3, shares FlexFrame format

As previously mentioned, QuantumScape’s first planned commercial product will be a solid-state cell called the QSE-5, based upon the aforementioned A0 prototype cells. QS states that the cell consists of a unique format it calls FlexFrame, which combines the conventional pouch and prismatic cell designs in order to address the “uniaxial expansion of lithium metal as it plates and strips during charging and discharging.”

The battery developer shared that a primary goal for 2023 is to improve the packaging of its QSE-5 cells compared to the A0 prototypes, as the former will contain higher-loading cathodes than the former, sustaining higher current densities built with tighter margins, putting more stress on the cell.

For comparison, QuantumScape says the QSE-5 cells are designed to deliver a capacity around 5 amp-hours (Ah), while 2170 battery designs currently used by some of the top EV automakers offer an average capacity of around 4.5–5 Ah. In this case, QuantumScape sits on the cusp of performance parity if not better, using smaller, lighter, and safer cells.

Switching back to the A0 prototypes that will enable the production of the QSE-5 cells someday, QuantumScape provided further room for optimism in its Q3 2023 report. The company states that although its commercial target for its solid-state cells remains at 80% energy retention through 800 charge cycles, one prospective automotive customer found much better results testing the A0 cells.

Those labs completed over 1,000 full cycle equivalents and achieved over 95% discharge energy retention using test conditions of C/3 charge and C/2 discharge with QuantumScape’s standard temperature and pressure conditions, and 100% depth of discharge. In the Q3 report, QuantumScape patted itself on the back for this encouraging result, but isn’t shopping for yachts any time soon – there is still plenty of room for improvement. Per the company:

We emphasize that this is the best-performing cell and we have work to do on aspects such as reliability. Nonetheless, this is an exceptional result. We are not aware of any automotive-format lithium-metal battery that has shown such high discharge energy retention over a comparable cycle count, at room temperature and modest pressure, regardless of C-rate. We believe that no competing electrolyte — solid or liquid — has demonstrated sufficient stability with lithium metal to achieve this, and that this result sets a new high-water mark for lithium-metal battery performance.

Credit: QuantumScape Q3 Report

Looking ahead, QuantumScape states that its work beyond Q3 2023 will remain focused on QSE-5 development, which could find much success in several applications serving all vehicles from passenger EVs, to commercial trucks, motorcycles, and even consumer electronics. In regard to electronics, QuantumScape’s Q3 report states that the company’s single-layer solid-state cells have now achieved between 1,500 to 2,000 cycles with approximately 80% discharge energy retention with zero externally applied pressure. For comparison, QS states that 500 to 1,000 charge-discharge cycles represents the key life cycle threshold for most consumer electronics applications.

On the manufacturing side, QuantumScape has completed equipment installation for its “Raptor” fast separator heat treatment process (3x as fast as previous processes) and remains on track to deploy the process by year’s end. It also continues to make progress in implementing its “Cobra” process to support the QSE-5 B0 prototype production in the future.

Financials look good as well. The Q3 report detailed $1.1 billion in liquidity as QuantumScape raised $300 million in gross proceeds the past three months. The company’s current forecast offers enough runway to continue solid-state cell development into 2026. Per QuantumScape:

Our focus for 2023 is simple: turn the corner from prototype to product. Our key milestones are all aimed at advancing product development to build a sufficient level of technical and manufacturing maturity to enable initial production of QSE-5. With just a few months remaining in the year, we are maintaining aggressive near-term schedules and remain focused on bringing a potentially disruptive first product to market in the near future.

But strategically, our mission is bigger than a series of near-term objectives. We have been pursuing a next-generation electric vehicle battery for over a decade, and with a mission as challenging and as important as this, long-term thinking is indispensable. Moreover, the market opportunity for our technology platform is massive, potentially in the hundreds of billions of dollars annually for decades to come.",https://electrek.co/2023/10/26/quantumscape-qs-q3-2023-prototype-solid-state-cells-exceed-targets/
QuantumScape considers cell production in Salzgitter,2021-05-16 00:00:00,"QuantumScape could produce solid-state batteries in the German city of Salzgitter with Volkswagen in the future. According to an agreement between the two companies, the location for the planned pilot plant with VW is to be determined this year.

According to the US battery specialist, Salzgitter is currently being considered for the pilot plant location. The plant, called QS-1, will initially have a capacity of 1 GWh, which will later be successively expanded to a total capacity of 21 GWh for series production.

Despite the announcement by its cooperation partner, Volkswagen says that no final decision has yet been made on the construction of a pilot plant for solid fuel cells in Salzgitter. “This technology of the future can only be built up in Germany with state support – because without such support Salzgitter has little chance in European and international comparison,” says a VW spokesperson. “The final decision on further steps towards a solid fuel cell pilot plant will be made in the fourth quarter at the latest.”

At QuantumScape, things sound much more optimistic. “Our goal has been to bring our solid-state lithium-metal batteries to market as soon as possible,” says Jagdeep Singh, CEO and co-founder of QuantumScape. “This joint venture brings together QuantumScape’s core battery technology with Volkswagen’s deep understanding of high-volume, high-quality production, and maximizes our ability to bring this technology into industrial production.”

Although the agreement was officially with Volkswagen Group of America, the fact that the Salzgitter site is being considered makes it clear that the group’s headquarters in Wolfsburg is the driver behind the cooperation.

Salzgitter is already a very important location for Wolfsburg’s battery plans: it is home to the pilot production facility for battery cells that will open in 2019. This project was initially driven forward with their battery partner Northvolt. After the Wolfsburg company announced at Power Day in March just passed that it would develop Salzgitter into one of the six European battery factories, it became clear that VW is now pushing ahead with the project alone. Salzgitter is also home to the pilot recycling plant for battery materials that opened in January 2021.

In February, QuantumScape announced the construction of a pilot plant called QS-0 in San José, California. At the end of March, QuantumScape announced in a stock offering that it would build a pilot plant with VW. A few weeks later, Volkswagen invested a further $100 million in the battery specialist, as QuantumScape’s cells had met contractually agreed requirements.",https://www.electrive.com/2021/05/16/quantumscape-considers-cell-production-in-salzgitter/
,2023-08-08,,https://s29.q4cdn.com/884415011/files/doc_presentation/2023/08/QS-IR-Presentation-August-23.pdf
"3 Reasons to Buy QuantumScape Stock, and 1 Reason to Sell",2023-12-14,"electric vehicle EV car battery lithium ion installation

More than 200 years since the battery was invented, and over 100 years since first being commercialized on a large scale, battery technology is more important than ever. For these big developments taking place, thank the automotive industry (along with some nudging from various governments and organizations around the world, not to mention Tesla's financial success). Automakers are trying to make a pivot from internal combustion engines (ICE) to electric vehicles (EVs) powered by lithium-ion batteries.

But there are big technology problems that still need to be solved that could add fuel to the EV fire (not literally, since an EV fire is no bueno). Enter QuantumScape (NYSE: QS), which continues to plug away at its ""battery technology platform"" with key automaker partners.

2023 was a wild year for QuantumScape's stock. There are reasons for optimism, but also one big red flag investors need to be mindful of. The thesis surrounding investing in QuantumScape boils down to three primary reasons.

1. QuantumScape is now shipping batteries to automakers

QuantumScape is working on a solid-state lithium-metal battery platform. Lithium-metal is promising, as it is more energy dense, which should theoretically increase the driving range of an EV.

The company's work centers on replacing traditional lithium-ion battery anodes with pure lithium-metal (an anode is the half of a battery that releases electrons and provides electric current during battery discharge). The idea is that other material innovations in the cathode (the receiving half of the battery during discharge, and the half that sends electrons back to the anode during charging) can be paired with QuantumScape's anode and ceramic separator technology (the separator is the material between the anode and cathode) to provide automaker and other manufacturing partners with a higher-performance custom battery setup for their specific needs.

There has been excitement throughout 2023 as the company said it was shipping prototype battery cells (the ""A0"") to prospective customers for testing. There is one prospective customer engagement that could possibly lead to EV production featuring QuantumScape's first production-ready battery, the QSE-5, though this project is small in scope for now.

Story continues

2. The company hired an executive with manufacturing experience

Adding further to the belief that QuantumScape is reaching an important inflection point, the company hired Dr. Siva Sivaram over the summer of 2023 to head up tech research and manufacturing. Sivaram has extensive experience in the semiconductor industry, last serving at memory chipmaker Western Digital, and before that as an executive at SanDisk (acquired by Western Digital in 2016).

QuantumScape itself said the hiring was important as it flips from a research and development focus to a battery production focus. Much like semiconductor manufacturing, battery production is a complicated process that would benefit from having someone with extensive experience.

3. The EV market is still growing fast

Of course, there have been media reports in the second half of 2023 about the slowing EV market, which is being throttled by higher interest rates. Higher rates increase the cost of financing, making an expensive new EV model less attractive to consumers.

Despite the bad press about an industry slowdown, though, the EV market is indeed still growing. Top lithium producer Albemarle confirmed as much in its latest financial update, showing that global EV sales remain on pace to increase 40% compared to 2022.

If that's true, it could be good news for QuantumScape. A growing EV market means there could be no shortage of demand for its lithium-metal batteries once they are ready for commercialization.

One reason to sell QuantumScape stock

Setting aside the optimism surrounding this start-up, there's one big reason to view QuantumScape with a healthy dose of skepticism.

This time last year, I said two things needed to happen for QuantumScape stock to sustain a rally. It needed to start realizing revenue and the U.S. Federal Reserve's interest rate hikes needed to start coming down (higher interest rates lower the present value of a company, in addition to making financing more expensive). Neither has happened.

The lack of revenue in particular underscores the fact that QuantumScape is still just a start-up. Because it reports zero revenue, the business racks up significant quarterly losses -- $121 million in operating losses in Q3 2023, and $354 million in operating losses in the first nine months of 2023).

To keep its balance sheet liquid during the R&D phase of its existence, QuantumScape sold more shares this past summer to raise an additional $288 million in cash (it ended Q3 with $1.1 billion in cash and short-term investments and zero debt). However, stock sales dilute ownership for existing shareholders, further amplifying the downward pressure on the stock.

Until QuantumScape starts reporting actual sales, it will be hard to justify a sustained rally higher for the stock price. At this juncture, QuantumScape should still be considered a high-risk and only potentially high-reward investment. At best, for most investors, this stock should merely be part of a diversified basket of EV battery and lithium technology and bets.

Should you invest $1,000 in QuantumScape right now?

Before you buy stock in QuantumScape, consider this:

The Motley Fool Stock Advisor analyst team just identified what they believe are the 10 best stocks for investors to buy now... and QuantumScape wasn't one of them. The 10 stocks that made the cut could produce monster returns in the coming years.

Stock Advisor provides investors with an easy-to-follow blueprint for success, including guidance on building a portfolio, regular updates from analysts, and two new stock picks each month. The Stock Advisor service has more than tripled the return of S&P 500 since 2002*.

See the 10 stocks

*Stock Advisor returns as of December 11, 2023

Nicholas Rossolillo and his clients has positions in Albemarle and Tesla. The Motley Fool has positions in and recommends Tesla. The Motley Fool has a disclosure policy.

3 Reasons to Buy QuantumScape Stock, and 1 Reason to Sell was originally published by The Motley Fool",https://finance.yahoo.com/news/3-reasons-buy-quantumscape-stock-103100127.html
"VW Invests $100M in QuantumScape, a Battery-Building Unicorn",2018-06-28,"Volkswagen Group just raised its stake in stealthy battery builder QuantumScape with a substantial $100 million bet. The world's automotive giants are in an expensive race for the lead in electric vehicles and this is just their most recent capital move.

QuantumScape was founded in 2010 as a Stanford University spinoff and was initially funded by ARPA-E for an ""all-electric battery."" That dubious idea was soon abandoned for a more traditional lithium metal solid-state approach. (""For battery nerds, 'solid-state' is synonymous with 'lithium metal anode,"" according to battery expert David Snydacker of Dosima Research.)

A few Silicon Valley publications have labeled QuantumScape a ""unicorn"" since it garnered a valuation of more than a billion dollars in its most recent funding round (according to PitchBook Data.) That's a heady valuation for a company still deep in its development phase and without significant revenue. (Theranos had a valuation of $9 billion at one point.)

Other investors in QuantumScape include Kleiner Perkins, Prelude Ventures, Lightspeed Venture Partners, Capricorn Investment Group, and Khosla Ventures. Optical networking aficionados will remember QuantumScape's CEO Jagdeep Singh as the very successful founder of Lightera and Infinera.

Dipender Saluja, managing director at Capricorn Investment Group is on QuantumScape's board, as is VW's Axel Heinrich. Bruce Sohn, former president of First Solar once served as president of QuantumScape.

Lithium metal anodes and the solid state battery

QuantumScape is not the only company considering solid state batteries. Startups working on this technology include Ionic Materials, Solid Energy (General Motors is an investor), and Prieto Battery. Sakti3, acquired by vacuum builder Dyson, was developing solid state batteries, as was the Bosch-acquired Seeo with its polymer electrolyte. Toyota has made significant investments in solid-state battery development.

Snydacker added: ""Lithium metal anodes go back to the very first lithium battery, invented by Exxon in the 1970s. In the four decades since Exxon's battery, many generations of battery scientists have tried and failed to create a commercial viable lithium metal battery that is rechargeable.""

""The major challenge with lithium metal is its propensity to undergo strong, often violent chemical reactions with almost every known material. Approximately 99.9 percent of materials undergo a chemical reaction when they are contacted with lithium metal. And, most of these reactions propagate continuously without passivation. In rare cases, the reaction may passivate and a form a 'kinetically stable' surface on the lithium metal. A mere 0.1 percent of materials are thermodynamically stable in contact with lithium metal. These materials can be used to protect the surface of lithium metal and facilitate durable operation of a battery.""

Automotive giants vying for an advantage in electric vehicles

Volkswagen has worked with QuantumScape since 2012 and claims to have tested sample battery cells that perform at ""automotive rates of power."" Even with more than eight years of development and significant funding, it's still going to take a joint venture between VW and QuantumScape another seven years to get to full production. That 2025 target for QuantumScape-electrified powertrains reveals the deep technical and execution challenge of bringing a new battery technology to full industrial production.

According to VW: ""A solid-state battery would increase the range of the E-Golf to approximately 750 kilometers compared with the present 300 kilometers. This battery technology has further advantages over the present lithium-ion technology: higher energy density, enhanced safety, better fast charging capability and — above all — they take up significantly less space.""

Greater energy density is the most important driver of solid-state lithium metal batteries, said Snydacker. ""Energy density will remain a key metric for batteries for two reasons. First, for an electric vehicle with a fixed battery pack size, cells with higher energy density enable a longer driving range. Second, for an electric vehicle with a fixed range requirement, cells with higher energy density enable a smaller cheaper battery pack. New exotic chemistries with high energy density may be more costly at first, but in the long run, as manufacturing processes mature, the cost of a battery approaches the cost of its raw material. Every kilogram of savings in the battery translates to a kilogram of savings in raw materials.""

Corporate investors making up for lack of VC interest

As Ben Kellison, GTM's Director of grid research, recently noted, ""Strategic investors have really taken over grid VC investment over the last 18 months or so, leading to lower total investment totals, but more meaningful investments."" The bulk of ""grid"" investment still goes to energy storage technologies.

So why does battery technology seem like a minefield to most traditional venture capital investors?

Shahin Farshchi, a partner at VC investor Lux Capital, spoke of the VC mismatch of investing in new battery technologies. Faced with the harsh reality of thermodynamics, battery startups have to make enormous efforts in time and capital to make just ""incremental gains,"" often seeing just ""single digit percentage performance improvements at the expense of another parameter.""

VCs are conditioned to seek product improvements that wreck markets, not incremental gains. But Farshchi would not dismiss QuantumScape's chances, acknowledging, ""VC is a game of special cases.""",https://www.greentechmedia.com/articles/read/vw-quantumscape-investment
QuantumScape & Volkswagen Sign Agreement for Joint Venture,2021-05-15 02:56:51+00:00,"SAN JOSE, Calif.–(BUSINESS WIRE)– QuantumScape Corporation, (NYSE: QS, or “QuantumScape”) today announced that it has entered into an agreement with Volkswagen Group of America, Inc. to select the location of their joint-venture solid-state battery pilot-line facility by the end of 2021. The companies currently contemplate Salzgitter, Germany for the location.

The pilot-line facility, QS-1, will initially be a 1-gigawatt hour (GWh) battery cell commercial production plant for electric vehicle batteries. QuantumScape and Volkswagen intend to expand production capacity by a further 20 GWh at the same location.

“Our goal has been to bring our solid-state lithium-metal batteries to market as soon as possible,” said Jagdeep Singh, CEO and co-founder of QuantumScape. “This joint venture brings together QuantumScape’s core battery technology with Volkswagen’s deep understanding of high-volume, high-quality production, and maximizes our ability to bring this technology into industrial production.”

QS-1 will follow QS-0, QuantumScape’s planned pre-pilot line. In its Q1 Shareholder Letter, QuantumScape highlighted progress on that front as well, securing a facility in San Jose to house the QS-0 line. To fulfill the strong inbound interest in its technology, the company also recently announced it was doubling the initial QS-0 capacity to over 200,000 cells annually, enough for hundreds of test vehicles each year.

In March, QuantumScape announced an additional $100 million in funding from Volkswagen after Volkswagen confirmed through tests at its labs in Germany that QuantumScape cells met the established technical milestone.

About QuantumScape Corporation

QuantumScape is a leader in developing next-generation solid-state lithium-metal batteries for use in electric vehicles. The company’s mission is to revolutionize energy storage to enable a sustainable future. For more information, please visit www.quantumscape.com.",https://www.quantumscape.com/press-release/quantumscape-and-volkswagen-sign-agreement-to-select-location-for-joint-venture-pilot-line-facility/
