title,date,text,url
"Silicon Valen, Spain: Plans to build a photovoltaic integrated manufacturing plant",,"The government of the Autonomous Region of Valencia, Generalitat Valenciana (GVA), has proposed to allocate funds to local company Silicon Valen SL to realize its plans to build a solar PV module factory in Spain.





It is reported that Silicon Valen SL plans to use the funds to purchase machinery and equipment to start the construction of the first phase of the photovoltaic factory, raw materials and batteries will be purchased from European companies. In the future, the company plans to launch 3 production plants to complete the final assembly process from silicon material to cells and modules.





Silicon Valen SL aims to have Phase 1 online in 2023 and commercial supply from October 2023.





This project is part of the implementation of Valencia's Industrial Strategic Plan, which aims to break away from Europe's strong dependence on China's solar supply chain in order to ensure European energy independence and decarbonization of the economy.



",https://www.manlybatteries.com/info/silicon-valen-spain-plans-to-build-a-photovo-72790898.html
Silicon Valen,,"As part of our ongoing commitment to the environment, we are creating a project that will promote European energy transformation most innovatively, employing solar energy, which expects to spearhead renewable energy markets.

It is a project that will enable a shift from fossil fuels to energy efficiency, reducing carbon emissions, limiting climate change, and boosting sustainable development.",https://siliconvalen.eu/en/inicio-english/
La firma Silicon Valen invierte 15 millones para arrancar la producción de paneles solares en 2023,,"19/12/2022 -

VALÈNCIA. La empresa Silicon Valen, formada por un grupo de empresarios valencianos vinculados al sector de las renovables, trabaja en la puesta en marcha de una gran factoría para la producción local de paneles solares. Un 'macroproyecto', con una inversión prevista de 500 millones de euros, que comprende la fabricación de toda la cadena de valor: desde la purificación del silicio hasta la fabricación de las células y módulos fotovoltaicos.

Sin embargo, la firma ha decidido empezar por la fabricación de los paneles solares ante la alta demanda que hay en el mercado y la dependencia actual con el mercado exterior, principalmente de China. Un arranque de la producción que comenzará a principios del próximo año para empezar a vender a finales de 2023 tras invertir cerca de 15 millones de euros.

Al frente de la compañía está Marcos Lacruz, presidente de la patronal Avaesen y CEO de NRG, acompañado de los hermanos Antonio y Gonzalo Navarro, propietarios de la extinta Siliken; y el consultor Manuel Argüelles. Todos ellos con una larga y dilatada trayectoria en la industria de las renovables, que ahora quieren recuperar en España con el foco puesto en la Comunitat Valenciana.

Por el momento, ya han alquilado una nave en Valencia para empezar el próximo año la fabricación de los módulos fotovoltaicos. Para ello, importarán las celdas de Israel, Alemania, Taiwan y China y en sus instalaciones valencianas ensamblarán los materiales -como aluminio o cristal- y la electrónica de proveedores locales, necesarios en la producción de paneles.

En un futuro, su objetivo es que todo el proceso se desarrolle en tierras valencianas. Sin embargo, han apostado por empezar por esta parte de la cadena de valor para atender la demanda que hay en el mercado y demostrar la calidad del producto final. ""En estos momentos hay un 'boom' de instalaciones con una demanda de 5 millones de módulos en España y el 95% procede del exterior. La previsión es que se multiplicará por dos en cinco años y, por tanto, consideramos que empezar por la fábrica de paneles tiene sentido"", señala Lacruz.

360.000 euros del Consell

De hecho, asegura que ya tienen pedidos garantizados porque han cerrado importantes alianzas con operadores industriales. También, su intención es exportar el producto a otros mercados europeos. ""Nuestro objetivo es garantizar la independencia energética en Europa y la descarbonización de la economía. España compra 7.500 millones de euros en módulos fotovoltaicos al año. Eso es dinero que se va fuera porque no hay industria en España ni en Europa para satisfacer la demanda porque todo lo produce China"", señala Lacruz.

De hecho, hace unos meses la empresa valenciana recibía una subvención de la Conselleria de Economía de 362.215,92 euros para la adquisición de maquinaría y bienes de equipo. Un montante, en el marco de una convocatoria de ayudas para impulsar proyectos industriales estratégicos en la Comunitat, que ha servido para la puesta en marcha del proyecto.

Los siguientes hitos, ya a medio plazo, pasan por el montaje de otras tres plantas enfocadas a la producción del silicio y el resto del proceso de ensamblaje hasta conseguir los paneles solares. De esta forma, la empresa aspira a abordar todo el sistema de fabricación en un momento en el que la demanda está disparada y la tensión geopolítica va in crecendo.

Fases del proyecto

En cualquier caso, de forma paralela ya se está trabajando en la búsqueda de las ubicaciones para las otras tres factorías. En concreto, en una de ellas se desarrollará la purificación y crecimiento del silicio; el siguiente proceso es su transformación en cilindros o lingotes; otro paso, la transformación en obleas para energía fotovoltaica; y en una última se crearán los módulos.

Lacruz insiste en la necesidad de recuperar una industria que desapareció en 2008. ""La demanda de energías renovables es muy alta y no podemos seguir con esa dependencia del mercado chino por las amenazas que hay. En España podemos hacerlo y conseguir así la reindustrialización de nuestro tejido"", remarca el empresario.",https://valenciaplaza.com/la-firma-silicon-valen-arrancara-en-2023-la-produccion-de-paneles-solares-con-sello-valenciano
Silicon Valley Getting a Rare New U.S. Solar-Manufacturing Plant,2021-05-11 00:00:00,"Bloomberg Investigates

Bloomberg Investigates takes viewers on an immersive journey to the heart of our most powerful reporting. Each investigation is recounted by award-winning journalists and the people who are living the story.",https://www.bloomberg.com/news/articles/2021-05-11/silicon-valley-getting-a-rare-new-u-s-solar-manufacturing-plant
Integrated Solar PV Manufacturing Planned In Spain,2022-07-04 14:25:35+00:00,"GVA grants over €360,000 to Silicon Valen SL for the latter’s plans to install solar panel manufacturing fab

The company plans to eventually launch integrated solar PV manufacturing capacity in Spain

Initially the plan is to procure raw materials and cells from European makers, and later expanding into vertical integration

Silicon Valen SL, a local Valencian company has secured a grant from the local government of Generalitat Valenciana (GVA) to materialize its plans of installing what the project promoters want to be an integrated solar PV module factory in Spain.

The company has secured a grant of €362,215.92 out of €1.44 million that GVA has shelled out as part of its 5th phase of the implementation of the Strategic Plan of the Valencian Industry.

“Silicon Valen SL will carry out the 1st phase of a process of implementation of the entire value chain of the photovoltaic solar energy generation process, from the purification of silicon to the manufacture of photovoltaic cells and modules, starting for the 1st module factory, with the aim of guaranteeing energy independence in Europe and the decarbonization of the economy,” stated the administration.

Silicon Valen is promoted by the President of the Valencian Association of Enterpreneurs of the Energy Sector (AVAESEN) Marcos J. Lacruz who is also the CEO of NRG Investment, along with Antonio and Gonzalo Navarro brothers who owned the now ‘extinct’ solar-grade silicon manufacturer Siliken SA. They are being helped by renewable energy consultant Manuel Argüelles.

Local news portal Valencia Plaza reported that the company plans to use the grant to acquire machinery and equipment to start the panel factory under phase I for which the promoters already have secured private investment of up to €10 million. To begin with, raw material and cells will be procured from European companies.

Under subsequent phases, they want to bring online 3 production plants to manufacture silicon, cells and final assembly process for modules.

The €500 million macroproject is aimed at ending the strong European dependence on Chinese solar supply chain. The target is to bring phase I online in 2023 and start commercial supply from October 2023 for which Silicon Valen has already secured initial orders.

As Europe accelerates its pace towards decarbonization and calls for local manufacturing for solar PV, there is a growing interest from investors. In France, a startup called Carbon is pursuing plans to launch 5 GW solar module fab (see ISC Konstanz To Help French Solar Gigafab Go TOPCon).",https://taiyangnews.info/integrated-solar-pv-manufacturing-planned-in-spain/
Spain's SiliconValen plans to build photovoltaic integrated manufacturing plant--Seetao,,"[Spain's SiliconValen plans to build photovoltaic integrated manufacturing plant]

Recently, the government of the Autonomous Region of Valencia, Generalitat Valenciana, intends to allocate funds to the local company Silicon Valen SL to realize its plan to build a solar photovoltaic module factory in Spain. Silicon Valen SL plans to use the money to purchase machinery and equipment to start the construction of the first phase of the photovoltaic plant, with raw materials and cells to be sourced from European companies. In the future, the company plans to launch 3 production plants to complete the final assembly process from silicon material to cells and modules. Editor/Xing Wentao",https://www.seetao.com/details/169567.html
