title,date,text,url
CATL's German plant receives approval for battery cell production,,"ARNSTADT, Germany, April 5, 2022 /PRNewswire/ -- On April 4, Contemporary Amperex Technology Thuringia GmbH (CATT), CATL's first plant outside of China, received the 2nd partial approval for the commissioning of a new plant for battery cell production from the state of Thuringia, Germany, marking a significant milestone for CATL's global footprint expansion despite the pandemic.

At the ceremony held in CATT at the Erfurter Kreuz industrial area, Anja Siegesmund, Thuringia's Minister of Environment, Energy and Nature Conservation, and Wolfgang Tiefensee, Thuringia's Minister of Economy, handed over the permit to Matthias Zentgraf, CATL's President for Europe, allowing an initial capacity of 8 GWh per year for the plant.

The construction of the plant, which is also Germany's first battery factory, is in the final stage and the installation of machines is in full swing so that the first cells can roll off the assembly lines by the end of 2022.

""CATT provides a fundamental impetus for the urgently needed energy transition, and we are glad to be the first company to receive approval to manufacture batteries 'Made in Germany',"" said Zentgraf, adding that the cooperation with the authorities during the approval process worked in an exemplary manner.

E-mobility in Germany is currently gaining immense momentum, and the state needs companies that are committed to taking sustainability and conservation into account right from the production stage, said Siegesmund.

""For Thuringia, CATT is one of the most important industrial investments in recent decades,"" said Tiefensee. ""At the same time, the project could be the initial spark for the emergence of a 'Battery Valley Thuringia,' as the first batch of CATL's supplier companies have settled around the area.""

CATT consists of two buildings: G1, an existing building purchased from another company and where cells are assembled to modules, and G2, a newly-built plant by CATT and where cells will be produced. The approval on Monday was issued to permit cell production of G2.

With clean rooms, technical cleanliness and constant humidity, the plant is almost as complex as a chip factory. Meanwhile, the plant generates part of its power from the solar power panels on the rooftop of the building in an effort to produce sustainably.

CATL broke ground on its German plant in 2019, and it is scheduled to start cell production by the end of 2022, when a total of 1,500 jobs will be created in Germany.

With a total investment of 1.8 billion euro, CATL plans to achieve a production capacity of 14GWh and create 2,000 jobs in Germany in the future.

Located at the heart of Germany, the plant is poised to provide high-quality products and services for major carmakers in Germany, thus promoting the electric mobility and energy transformation in Europe.

SOURCE CATL",https://www.prnewswire.com/news-releases/catls-german-plant-receives-approval-for-battery-cell-production-301518553.html
CATL Unveils Its Latest Breakthrough Technology by Releasing Its First Generation of Sodium-ion Batteries,,"Breaking through the bottleneck of sodium-ion battery technology

As carbon neutrality has become a global consensus, the new energy industry has entered a complex and diversified development stage. The increasingly segmented markets have raised differentiated requirements for batteries. At the same time, the worldwide research and development of basic materials for batteries is accelerating, which opens a two-way window for the industrialization of sodium-ion batteries.

The sodium-ion battery has a similar working principle to the lithium-ion battery. Sodium ions also shuttle between the cathode and anode. However, compared with lithium ions, sodium ions have a larger volume and higher requirements regarding structural stability and the kinetic properties of materials. This has become a bottleneck for the industrialization of sodium-ion batteries.

CATL has been dedicated to the research and development of sodium-ion battery electrode materials for many years. In terms of cathode materials, CATL has applied Prussian white material with a higher specific capacity and redesigned the bulk structure of the material by rearranging the electrons, which solved the worldwide problem of rapid capacity fading upon material cycling. In terms of anode materials, CATL has developed a hard carbon material that features a unique porous structure, which enables the abundant storage and fast movement of sodium ions, and also an outstanding cycle performance.

Based on a series of innovations in the chemistry system, CATL's first generation of sodium-ion batteries has the advantages of high-energy density, fast-charging capability, excellent thermal stability, great low-temperature performance and high-integration efficiency, among others. The energy density of CATL's sodium-ion battery cell can achieve up to 160Wh/kg, and the battery can charge in 15 minutes to 80% SOC at room temperature. Moreover, in a low- temperature environment of -20°C, the sodium-ion battery has a capacity retention rate of more than 90%, and its system integration efficiency can reach more than 80%. The sodium-ion batteries' thermal stability exceeds the national safety requirements for traction batteries. The first generation of sodium-ion batteries can be used in various transportation electrification scenarios, especially in regions with extremely low temperatures, where its outstanding advantages become obvious. Also, it can be flexibly adapted to the application needs of all scenarios in the energy storage field.

Four-pillar innovation system in support of three strategic development directions

CATL has always been committed to being a global premier innovative technology corporation and delivering excellent contributions to the green energy resolution for mankind as its vision. To achieve its vision, CATL is making unremitting efforts in three strategic development directions. The first development direction is to replace stationary fossil energy with renewable energy generation and energy storage; the second is to replace mobile fossil energy by using EV batteries to accelerate the development of E-mobility; the third is to promote the integration innovation of market applications leveraging electrification plus intelligence to accelerate the drive towards new energy applications in different fields. To support sustainable development in these three development directions, CATL has established a four-pillar innovation system, namely in the chemistry system, structure system, manufacturing system and business models, to build a rapid transformation capability from fundamental research to industrial application, and then to large-scale commercialization.

The fundamental research of material and the chemistry system is of great importance. Dr. Robin Zeng, chairman of CATL, has said that some people believe that the battery chemistry system will hardly see any more breakthroughs, and that only improvements can be made in the physical structure system. But we believe that the world of electrochemistry is like the Energy Cube, where there are still a lot of unknowns for us to discover. We never get tired of exploring its mysteries. By using a high-throughput calculation platform and simulation technology, based on our deep understanding of principles combined with the application of advanced algorithms and computing capacity, we engage in an in-depth exploration to develop a chemistry system that is most suitable for sodium-ion batteries, enable them to enter the fast track to industrialization, and continuously evolve. The next generation of sodium-ion batteries' energy density development target is to exceed 200Wh/kg.

In terms of battery system innovation, CATL has made another breakthrough in battery system integration and developed an AB battery system solution, which is to mix and match sodium-ion batteries and lithium-ion batteries in a certain proportion and integrate them into one battery system, and control the different battery systems through the BMS precision algorithm. The AB battery system solution can compensate for the current energy-density shortage of the sodium-ion battery, and also expand its advantages of high power and performance in low temperatures. Thanks to this innovative structure system, application scenarios for the lithium-sodium battery system are expanded.

Multi-dimensional deployment to promote the industrialization of sodium-ion batteries

At the event, Dr. Qisen Huang, deputy dean of the CATL Research Institute, said that sodium-ion battery manufacturing is perfectly compatible with the lithium-ion battery production equipment and processes, and the production lines can be rapidly switched to achieve a high-production capacity. As of now, CATL has started its industrial deployment of sodium-ion batteries, and plans to form a basic industrial chain by 2023. CATL invites upstream suppliers and downstream customers, as well as research institutions to jointly accelerate the promotion and development of sodium-ion batteries.

Dr. Robin Zeng said that carbon neutrality has spawned a demand for TWh-scale batteries and has promoted the vigorous development of the new energy industry. The continued emergence of application demands has given an opportunity to showcase the capabilities of different technologies. Diversified technical routes will also assure the stability of the industry's long-term development.

About CATL

Contemporary Amperex Technology Co., Limited (CATL) is a global leader in new energy technology innovation, committed to providing premier solutions and services for new energy applications worldwide. In June 2018, the company went public on the Shenzhen Stock Exchange with stock code 300750. According to SNE Research, in the year 2020, CATL's EV battery consumption volume ranked No.1 in the world for four consecutive years. CATL also enjoys wide recognition by global OEM partners. To achieve the goal of realizing fossil fuel replacement in stationary and mobile energy systems with highly efficient electrical power systems that are generated through advanced batteries and renewable energy, and promote the integrated innovation of market applications with electrification and intelligentization, CATL maintains continuous innovation in four dimensions including battery chemistry system, structure system, manufacturing system and business models.

For more information, please visit http://www.catl.com

SOURCE Contemporary Amperex Technology Co., Ltd.

Related Links

www.catl.com



× Modal title

PRN Top Stories Newsletters Sign up to get PRN’s top stories and curated news delivered to your inbox weekly! Enter Your Email Select Country Select Country Submit Thank you for subscribing!



Our newsletters contain tracking pixels to help us deliver unique content based on each subscriber's engagement and interests. For more information on how we will use your data to ensure we send you relevant content please visit our By signing up you agree to receive content from us.Our newsletters contain tracking pixels to help us deliver unique content based on each subscriber's engagement and interests. For more information on how we will use your data to ensure we send you relevant content please visit our PRN Consumer Newsletter Privacy Notice . You can withdraw your consent at any time in the footer of every email you'll receive.



Unsere Newsletter enthalten Zählpixel, die die Lieferung einzigartiger Inhalte in Bezug auf das Abonnement und die Interessen der einzelnen Abonnenten ermöglichen. Weitere Informationen über die Verwendung Ihrer Daten im Hinblick auf die Zusendung von relevanten Inhalten, finden Sie in unserer Mit Ihrer Anmeldung erklären Sie sich damit einverstanden, Inhalte von uns zu erhalten.Unsere Newsletter enthalten Zählpixel, die die Lieferung einzigartiger Inhalte in Bezug auf das Abonnement und die Interessen der einzelnen Abonnenten ermöglichen. Weitere Informationen über die Verwendung Ihrer Daten im Hinblick auf die Zusendung von relevanten Inhalten, finden Sie in unserer PRN Consumer Newsletter Privacy Notice . Ihre Zustimmung können Sie jederzeit in der Fußzeile jeder erhaltenen E-Mail widerrufen.



Notre newsletter contient des pixels espions nous permettant la fourniture à chaque abonné, d’un contenu unique en lien avec ses souscriptions et intérêts. Pour de plus amples informations sur l’utilisation faite de vos données en vue de l’envoi des contenus concernés, nous vous invitons à consulter la politique de confidentialité disponible à partir du lien suivant En vous inscrivant à la newsletter, vous consentez à la réception de contenus de notre part.Notre newsletter contient des pixels espions nous permettant la fourniture à chaque abonné, d’un contenu unique en lien avec ses souscriptions et intérêts. Pour de plus amples informations sur l’utilisation faite de vos données en vue de l’envoi des contenus concernés, nous vous invitons à consulter la politique de confidentialité disponible à partir du lien suivant PRN Consumer Newsletter Privacy Notice . Vous pouvez à tout moment revenir sur votre consentement par le biais des informations situées au bas de chaque e-mail reçu.",https://www.prnewswire.com/news-releases/catl-unveils-its-latest-breakthrough-technology-by-releasing-its-first-generation-of-sodium-ion-batteries-301343998.html
CATL launches cell production in new 60 GWh factory,2021-12-22,"The Chinese battery cell manufacturer CATL has started production at its largest plant to date in Fuding near Ningde in Fujian province, which is to offer an annual capacity of 120 GWh when completed. The first phase, which has now started, is said to have a capacity of 60 GWh per year.

The Fuding plant is CATL’s largest single project to date. To illustrate the scale: This battery factory alone has a planned capacity almost equal to the total installed capacity of all battery cell manufacturers in China in the first eleven months of 2021 – which was 128.3 GWh. According to current battery prices, 120 GWh would have a production value of over 100 billion yuan, or just under 14 billion euros.

CATL had announced a new plant in Ningde in February 2020, which it said at the time would be completed within two years. The planned production capacity of the plant, which will cost up to 10 billion yuan (about 1.3 billion euros at the time), was not mentioned in 2020.

However, construction did not start until this year, Liu Henghua, operational manager of the project, said, according to a report in the Fujian Daily. “With the support of government departments at all levels, Fuding CATL took about 330 days from the piling of the plant to the commissioning of the first production line, achieving the start of construction to commissioning in the same year,” Liu said.

It is not clear from the reports how quickly full utilisation of the 60 GWh of the first phase will be achieved. According to the report, the first phase will include four cell plants, three module assemblies and “supporting facilities” such as warehouses and dormitories. The plant is expected to create a total of about 10,000 jobs.

In addition, on 19 December, CATL broke ground for the construction of another production facility in Xiamen in Fujian Province, which is to be completed in December 2024 with a capacity of around 20 GWh.

The company – like virtually all cell manufacturers – is on a huge expansion course. According to figures from the China Automotive Battery Innovation Alliance (CABIA), CATL had an installed production capacity of 11.45 GWh in China in November, giving it a market share of 55 per cent. However, the company has already announced its own plants and production facilities of joint ventures with carmakers, which add up to 600 GWh.

cnevpost.com, gasgoo.com",https://www.electrive.com/2021/12/22/catl-launches-cell-production-in-new-60-gwh-factory/
CATL: Staying on top of the battery game,2023-12-01,"Last year, CATL produced 37% of the world’s EV batteries and 43.4% of energy storage batteries for a grand total of 289 GWh and 2023 is shaping to be another landmark year.

According to South Korean research firm SNE Research, CATL cemented its domination of the global EV industry in the January-August period this year with 37% market share, followed by second-ranked BYD with 16%. Its sales outside of China reached 27.7%, up by 6.9% year-on-year.

As pv magazine learned from CATL, in the third quarter of 2023, the company’s battery sales volume stood at around 100 GWh, with BESS accounting for nearly 20%.

According to CATL, innovation is the key driver of its growth. In the first three quarters of 2023, CATL invested about 14.88 billion yuan ($2.1 billion) in R&D.

As of the first half of 2023, CATL’s issued and pending patents have reached 22,039 worldwide, and it has contributed to the drafting or amending of over 110 industry standards at home and abroad.

With R&D centers in Ningde, Liyang, Shanghai, Xiamen and Munich, which employ more than 17,998, CATL is managing to stay at the forefront of development in energy storage technologies.

Some of its key breakthroughs include the development of liquid-cooling energy storage solutions with long service life and high level of safety.

pv magazine roundtables Europe 2023 Session 8 | Dec 6, 10:30 am CET, virtual | All about storage: Price, materials, tech, and new revenue As the energy storage sector continues to grow and mature, understanding costs and revenue opportunities is the highest priority for many stakeholders. As lithium-based batteries continue to dominate the sector, the outlook on costs, materials, and technology remains the key question. In addition, we will also explore the most attractive markets and revenue opportunities for BESS in Europe, beyond the wins in transferring energy from generation to times of demand. Experts: Evan Hartley, Benchmark Mineral Intelligence

Max Reid, Wood Mackenzie

Aaron Wade, Exawatt

Winfried Wahl, Hithium Energy Storage Deutschland

Ryan Alexander, Aurora Energy Research

Steven Coppack, Timera Energy More information

Furthermore, CATL has worked on low lithium consumption anode, which reduces the consumption of active lithium content while improving the stability of the anode material surface and structure as well as self-repairing electrolyte, which improves cell storage and cycling performance.

It has also achived big results with its passivated cathode with the help of doping and coating techniques to reduce side reactions in high-voltage scenarios.

Popular content

As CATL underlines, “ensuring the safety of energy storage batteries poses far greater challenges than those for EV batteries, as it requires a much higher level of consistency in manufacturing as well as innovation in cell and system design.”

By deploying advanced technologies including 5G, flexible automation and IoT, CATL has achieved a defect rate of DPPB (single defect rate per billion) for its cells, which is the top in the industry.

As for the next frontier in development of lithium-iron-phosphate (LFP) batteries, today's leading energy storage technology, CATL’s goal is further optimization of product performance including service life, power rating, and direct current resistance (DCR), which will in return pave the way to more competitive batteries for its customers.

In terms of cycle life, CATL has already made and deployed batteries capable of cycling 12,000 times. In 2020, CATL deployed the 12,000-cycle ultra-long-life batteries at the Jinjiang 100 MWh Energy Storage Power Station, which has been operating safely ever since, according to the company. CATL’s stated goal is to increase the cycle life to 18,000 cycles.

Beyond lithium-ion stationary storage technology, CATL is also at the forefront of development of the sodium-ion chemistry. It sees the technology as compatible and complementary to lithium-ion batteries.

CATL says it has successfully built the basic industry chain for sodium-ion batteries and established the mass production capacity, noting that the production volume and shipment scale depend on the implementation of customers’ projects.

According to CATL, there are still many conditions that need to be met in the market before the large-scale commercial application of sodium-ion technology. “We hope that the whole industry will work together to promote the development of sodium-ion batteries,” company representatives say.

In 2021, CATL rolled out its first generation sodium-ion battery with an energy density of 160 Wh/kg and promised an increase to 200 Wh/kg for the next generation. In April, it confirmed that Chinese Chery will become the first automaker to use its sodium-ion battery tech.

This year, CATL has also signalled that it is setting a foot into the emerging field of long-duration energy storage. In November, the manufacturer announced a 10 GWh supply deal inked with Australian renewable energy investor Quinbrook, which will initially involve the delivery of 1 GWh of CATL’s latest outdoor container LFP solution called EnerC Plus.

It also said that the partners will work closely together to assess the viability of “CATL's groundbreaking 8hr charge and 16hr discharge energy storage solution” for use on the Sun Cable Project located in Australia's Northern Territory, which is expected to include up to 20 GW of solar and up to 42 GWh of battery storage.

In the EV sphere, CATL’s major announcement this year was the development of the “condensed matter” battery, a type of semi-solid state product with condensed electrolyte and new anode and separator materials, will have an energy density of up to 500 Wh/kg.

This was preceeded by the launch of Qilin battery in 2022, the third generation of its cell-to-pack technology, claiming the highest integration level to date. With a record-breaking volume utilization efficiency of 72% and an energy density of up to 255 Wh/kg, Qilin is capable of delivering a range of over 1,000 km and equating to a five-minute hot start and ten minutes of charging to get from 10-80% state of charge.",https://www.pv-magazine.com/2023/12/01/catl-staying-on-top-of-the-battery-game/
CATL takes off – Europe’s largest cell production facility starts production,2023-05-05,"Thuringia is home to one of the largest investments of this kind in Europe and marked a major milestone at the beginning of the year: Chinese global market leader Contemporary Amperex Technology Co. Ltd. (CATL) is building its first battery cell manufacturing facility outside of China in the industry park “Erfurter Kreuz” and officially launched its local production of lithium-ion cells at the end of January. CATL is investing around EUR 2 billion in what is currently Europe’s largest cell production facility; up to 2,000 jobs will be created.

After delays caused by Corona, production was set up according to plan: Production initially started on two module lines, and by the end of 2023 the planned six lines are scheduled to go into operation, generating an output of 24 GWh/a. In the meantime, the number of employees has grown to around 1,000. Thuringia's Minister President Bodo Ramelow, Economics Minister Tiefensee, Environment Minister Anja Siegesmund and representatives of LEG Thüringen, who have intensively accompanied this investment, took part in the inauguration ceremony. At the site south of the Thuringian capital of Erfurt, the company focuses not only on manufacturing but also on research and development and in the nearby Erfurt cargo hub the CATL European logistics headquarters are established. Thuringia is fast evolving into one of Europe’s most innovative regions for the future of mobility, especially electric vehicles. For example, the state recently funded the establishment of the new Battery Innovation and Technology Center (BITC), which is already partnering with CATL. (hw)",https://www.invest-in-thuringia.de/en/news/news-detail/catl-takes-off-europes-largest-cell-production-facility-starts-production/
