title,date,text,url
CATL reportedly vetting sites for US battery production to support BMW and Ford,2022-05-06,"A recent report states that global battery conglomerate CATL is in the final stages of vetting potential sites to bring EV battery production to the US. The move would mark the company’s first entry into the second largest automotive market in the world, and the new facilities would provide cells to BMW AG and Ford Motor Company for their EV production stateside.

Contemporary Amperex Technology Co Ltd., better known as CATL, is a global energy technology company and the leading EV battery manufacturer in China. Beyond Asia, the company has retained its crown as the world’s largest battery manufacturer by installed capacity for a fifth-straight year.

In addition to recent projects to implement battery recycling and net-zero carbon manufacturing facilities in China, CATL has begun to expand outside of its home country. Its first announcement came this past April with plans for an 8 GWh battery plant in Germany.

A week later, CATL announced a $6 billion investment to mine, manufacture, and recycle batteries in Indonesia, expanding its global reach further. According to the latest report, CATL plans to soon be manufacturing EV batteries in the US as well, and could be providing cells to US automakers assembling nearby.

Ford’s assembly plant in Louisville, Kentucky / Source: Ford Motor Co.

Could CATL be making batteries in the US for Ford and BMW?

According to a report from Reuters, sources close to the matter say CATL is in the final stages of determining potential sites to set up US manufacturing. Two possible locations include South Carolina and Kentucky, where BMW AG and Ford Motor Company currently have assembly plants.

According to sources who asked not to be identified, talks are ongoing, but CATL would provide battery cells to both BMW and Ford from facilities erected near their respective assembly plants. One source elaborated, stating that CATL is looking to commence battery production for BMW in South Carolina by 2026.

In a statement, current CATL customer BMW shared it is “intensively examining the possibility of establishing a battery factory” in the US, as well as acquiring battery materials stateside. The company also said it is in talks with several partners regarding the factory.

Last September, Ford announced a massive EV production project called Blue Oval City in Tennessee, which included a battery plant with the help of SK Innovation. Additionally, the two parties shared plans for a second plant near Ford’s assembly facilities in Louisville, Kentucky.

With electric truck demand beginning to soar for the American automaker, additional battery cells in Tennessee or Louisville make sense. Considering Tennessee is where the electrified trucks are currently planned to be produced, a CATL plant feels like a better fit.

However, that isn’t to say Ford won’t refurbish its Kentucky plants currently assembling ICE vehicles like the Escape, Expedition, and F Series to support EVs, too, especially since it’s already building a battery plant there with SK. Ford declined to comment.

CATL’s expedited expansion to the US comes at an opportune time, following the Department Energy’s recent $3 billion program to support local battery manufacturing – part of the Biden administration’s larger $7.5 billion infrastructure bill approved last year.

CATL has declined to comment so far.",https://electrek.co/2022/05/06/catl-reportedly-vetting-sites-for-us-battery-production-to-support-bmw-and-ford/
CATL to build new battery making projects with up to $3.8 billion investment,2021-12-30,"This is the seventh to tenth phase of CATL's Yibin manufacturing base, with a planned site area of approximately 2.13 million square meters.

Contemporary Amperex Technology Co Ltd (CATL), the power battery supplier to Tesla and NIO, announced today that it will invest up to RMB 24 billion ($3.8 billion) in power battery manufacturing projects in Yibin, Sichuan province.

This is the seventh to tenth phase of CATL's Yibin manufacturing base, with a planned site area of approximately 3,200 mu (2.13 million square meters) and a construction time of no more than 20 months for each phase, according to the company's announcement.

With the rapid development of the domestic and international new energy vehicle (NEV) market, the market for the power battery industry continues to grow, and the move is to further promote business development and meet market demand, CATL (SHE: 300750) said.

On December 28, CATL signed an investment agreement with the Yibin Municipal Government regarding the project.

Separately, CATL said in another announcement that it today signed a framework agreement with Zhejiang Vision Auto-Parts Fittings Co, a subsidiary of Geely Holding Group, for battery supplies.

CATL will supply power cells to Zhejiang Vision from 2022 to 2026, with the latter's combined procurement volume not less than 57 GWh.

Ningde City, Fujian province-based CATL is the world's largest power battery supplier, maintaining its dominant position in the global electric vehicle battery market with a 31.8 percent share from January to November, according to data from South Korean market research firm SNE Research.

In China, CATL topped the market with a 55 percent market share in November, while BYD was second with 16.6 percent and CALB was third with 5.2 percent, according to data released earlier this month by the China Automotive Battery Innovation Alliance (CABIA).

From January to November, CATL's market share in China was 51.4 percent, higher than BYD's 16.6 percent in second place, CABIA's data showed.

CATL's project in Yibin is just one part of its rapid expansion of production capacity.

The first phase of CATL's new lithium-ion battery production site in Fuding, Fujian province, started production on December 21 at Plant 2, marking the start of the site's actual capacity contribution to the company, according to a report in the local Fujian Daily last week.

The production base is CATL's largest single project in the world to date, with a planned annual capacity of 120 GWh and an output value of over RMB 100 billion, according to the report.

120 GWh of capacity is a big number, almost all of China's installed power battery capacity in the first 11 months of the year.",https://cnevpost.com/2021/12/30/catl-to-build-new-battery-making-projects-with-up-to-3-8-billion-investment/
A Hungarian Town Seethes Over a Giant Chinese Battery Plant,2023-03-15,"The small-town mayor, long a loyal foot soldier for Hungary’s governing party, recently committed what he described as “political suicide,” throwing himself in the path of an enormous $7.8 billion Chinese battery factory project promoted by his dissent-intolerant prime minister, Viktor Orban.

“It is like lying in front of a steamroller,” Zoltan Timar, the mayor of Mikepercs, said of his decision to side with residents opposed to the project, which his Fidesz party championed. “I just hope it won’t roll over me too soon.”

The factory, which would be the biggest of its kind in Europe, is the fruit of a yearslong diplomatic and economic tilt by Mr. Orban away from the West toward countries like China and Russia. It promises to put Hungary at the center of a wrenching and, for some, highly profitable green transition, with electric cars leading the way.

But residents in Mikepercs, a Fidesz stronghold in eastern Hungary, are seething over the arrival on nearby farmland of bulldozers and dump trucks preparing the way for the Chinese plant. Many worry the project would create pollution, drain their water supply and bring an influx of Chinese and other foreign workers.",https://www.nytimes.com/2023/03/15/world/europe/hungary-china-battery-plant.html
CATL begins operations at new battery facility capable of producing one cell per second,2023-10-30,"CATL, the world’s largest battery maker, is now becoming the fastest as well, thanks to state-of-the-art production lines at its new battery base in China. The developer says its new assembly lines can produce a battery cell per second and an entire EV battery pack in under three minutes.

CATL remains the undisputed leader in EV battery development, not only in China, where it is headquartered, but around the world. Despite a slight drop in net profits in Q3 of this year, CATL looks like it will maintain its crown in 2024 as the largest shareholder in the battery market – a title it has already held for six straight years.

CATL’s share of over 30% of the entire market is no accident either. It continues to develop and produce some of the most advanced battery tech out there. Its energy-dense Qilin batteries have begun rolling out within ZEEKR EVs out of China, and we’ve even seen the company look to the skies by developing cells to support all-electric aviation.

The company has even introduced its own EV startup alongside Chinese tech company Huawei. In August, the company introduced a lithium-iron-phosphate (LFP) cell called ShenXing – capable of recouping 400km (249 miles) of range during a single 10-minute fast charge.

As CATL’s battery lineup continues to expand, so has its global production footprint. Just recently, the company began operations at a new production base in China, with assembly speeds that should help it keep a leg up on the competition.

Credit: Shi Zhaochang/Xinhua

CATL’s opens new highly automated battery base in China

According to a press release from CATL, operations commenced at the new battery facility located in the Guian New District of southwest China’s Guizhou province on October 27. The location is CATL’s latest home to power and energy storage battery production.

The 235+ acre site will eventually support two phases of the production base, the first of which is now complete and designed to deliver an annual production capacity of 30 GWh. CATL states that the first phase of the battery production base costs approximately RMB 7 billion ($957 million) and utilizes an advanced production line with an automation rate of 95%, delivering “a high production pace and high flexibility.”

Speaking of high pace, CATL relayed that the process from material feeding to a finished battery product is down to one cell per second and one entire battery pack in 2.5 minutes. When phase two is complete, CATL’s battery production capacity in Guizhou is expected to double to 60 GWh.

There is no timeline yet on when that next phase will begin construction.",https://electrek.co/2023/10/30/catl-begins-operations-new-battery-facility-producing-one-cell-per-second/
